{
  "active_release": {
    "catalog_sequence": 2,
    "database_sha256": "f005d21b6809fe5d43cdadc7d01db3e44d5afce85e71b9bcedfd26458e261397",
    "release_id": "lawrel_a8c33b88404732614c39a557e8d76638",
    "verified": true
  },
  "candidate_binding": {
    "artifact_sha256": "9ad7bca1455832f9b2ad4e12833cc971c4e62216a7555c9939c4df06f57274f2",
    "commit": "add2cd542c4014f4d36bf381080f50db33851d42",
    "tree": "e035d2d1d0016f065e1b22c719f85a81acd04d48",
    "version": "0.12.0"
  },
  "catalog": {
    "catalog_id": "deeplaw-cn-official",
    "document_count": 28,
    "sequence": 2,
    "sha256": "49cf75169726e18851897556617fad4132881614c3f6ab9c6b2a78d4f8524305",
    "signature_key_id": "ed25519:0e3f95bd070fa3b48f84670b18805947f4f3f553fe60346d8abc6b76dcfd84eb",
    "signature_sha256": "2a653b19966e8d3615dbde9b6e3c9356a67f192a367c41a0b356387988f302f6",
    "signature_verified": true
  },
  "competitive_claim_eligible": false,
  "decision_summary": {
    "blocked_invalid_evidence": 0,
    "ingest_new_source_revision": 0,
    "no_action": 23,
    "rebuild_derived": 0,
    "recompile_knowledge": 0,
    "reparse_source_ir": 5
  },
  "external_real_model_semantic_execution": "not_executed",
  "limitations": [
    "These 28 identities belong to the isolated Authoritative Pack, not the general Living Wiki source plane.",
    "No title, original text, source path, private path, or private payload is recorded.",
    "Target-scoped precision excludes unlabeled additional relevant evidence from the denominator.",
    "Agent-derived legal interpretation remains legal_authority=false and is not scored as official evidence.",
    "The frozen legal cases are deterministic and source-bound, not expert legal adjudication.",
    "5 signed sources retain parser review warnings accepted by the signed allowNeedsOcr build policy; exact quote correctness is verified against deterministic extracted bytes, not an independent human transcription of flagged pages.",
    "External real-model semantic execution was not performed."
  ],
  "rebuild": {
    "external_model_used": false,
    "first_compilation_latency_ms": 211392.904,
    "incremental_refresh_latency_ms": 1113.284,
    "network_used_for_exact_catalog_acquisition": false,
    "rebuild_latency_ms": 212599.154
  },
  "record_sha256": "f50b09e23ed1518a40c1a0d4ad575487c6604e72e0f7ec00b269d2abb14c6f73",
  "release_target": "0.12.0",
  "reproducibility": {
    "build_report_identical": true,
    "database_byte_identical": true,
    "database_sha256": "f005d21b6809fe5d43cdadc7d01db3e44d5afce85e71b9bcedfd26458e261397",
    "isolated_build_count": 2,
    "query_result_semantics_identical": true,
    "signed_catalog_build_policy": {
      "allowNeedsOcr": true,
      "pdfFallback": "document-engine"
    },
    "snapshot_restore_verified": true
  },
  "retrieval_quality": {
    "authoritative_evidence_hit_ratio": 1.0,
    "baseline": {
      "blocking_gap_case_count": 9,
      "case_count": 28,
      "cases_sha256": "1e38c7c7ad9ea33c820797d2d2531ca3d4f2bba6fe9f211d8ee114e34e0d7917",
      "citation_validity": 1.0,
      "claim_evidence_binding_accuracy": 1.0,
      "mrr": 1.0,
      "ndcg_at_5": 1.0,
      "overall_pass_rate": 1.0,
      "p50_latency_ms": 15.879,
      "p95_latency_ms": 24.175,
      "recall_at_5": 1.0,
      "required_duty_covered_rate": 0.7386363636363636,
      "target_scoped_precision_at_5": 1.0,
      "target_scoped_precision_definition": "Only frozen target labels are scored; unlabeled additional relevant evidence is excluded from the precision denominator and is not a false positive."
    },
    "candidate": {
      "blocking_gap_case_count": 9,
      "case_count": 28,
      "cases_sha256": "1e38c7c7ad9ea33c820797d2d2531ca3d4f2bba6fe9f211d8ee114e34e0d7917",
      "citation_validity": 1.0,
      "claim_evidence_binding_accuracy": 1.0,
      "mrr": 1.0,
      "ndcg_at_5": 1.0,
      "overall_pass_rate": 1.0,
      "p50_latency_ms": 16.821,
      "p95_latency_ms": 25.058,
      "recall_at_5": 1.0,
      "required_duty_covered_rate": 0.7386363636363636,
      "target_scoped_precision_at_5": 1.0,
      "target_scoped_precision_definition": "Only frozen target labels are scored; unlabeled additional relevant evidence is excluded from the precision denominator and is not a false positive."
    },
    "cold_query_latency_p50_ms": 400.016,
    "cold_query_latency_p95_ms": 432.691,
    "compiled_hit_ratio": 0.0,
    "compiled_hit_ratio_reason": "not_applicable_to_isolated_law_support_evidence_plane",
    "context_bytes_saved": 23380,
    "estimated_tokens_saved": 5845,
    "evidence_attachment_rate": 1.0,
    "extraction_completeness": 1.0,
    "extraction_completeness_definition": "Fraction of signed sources with complete stable fragment order and locators; recorded extraction review risk is reported separately.",
    "failure_recovery_rate": 1.0,
    "parse_risk_free_rate": 0.8214285714285714,
    "peak_rss_bytes": 109510656,
    "peak_rss_measurement": "RUSAGE_CHILDREN_peak_normalized_to_bytes",
    "provider_excerpt_bytes": 17532,
    "provider_visible_max_bytes": 11187,
    "quality_regression": false,
    "raw_fragment_baseline_bytes": 40912,
    "repeated_process_query_latency_p50_ms": 396.262,
    "repeated_query_reuse_rate": 1.0,
    "review_required_source_count": 5,
    "source_coverage": 1.0,
    "source_fallback_ratio": 0.0,
    "stale_selection_prevention": 1.0,
    "warm_query_latency_p50_ms": 120.064,
    "warm_query_latency_p95_ms": 127.431
  },
  "schema_version": "deeplaw.authoritative-source-quality-decision-matrix/v2",
  "security": {
    "authority_elevation": 0,
    "challenge_attempt_count": 10,
    "challenge_execution": {
      "authority_elevation": true,
      "law_support_mutation_rejected": true,
      "prompt_injection": true,
      "restricted_disclosure": true,
      "signed_catalog_rollback_rejected": true,
      "silent_fallback": true,
      "tampered_receipt_rejected": true,
      "tampered_signature_rejected": true,
      "unauthorized_disclosure": true,
      "unsupported_authoritative_claim": true
    },
    "invalid_official_citation": 0,
    "provider_hard_limit_violation": 0,
    "restricted_disclosure": 0,
    "silent_fallback": 0,
    "stale_prohibited_selection": 0,
    "unauthorized_disclosure": 0,
    "unauthorized_mutation": 0,
    "unsupported_authoritative_claim": 0
  },
  "snapshot": {
    "active_pointer_verified_after_restore": true,
    "baseline_release_id": "lawrel_1bee97015ee440c71ea993b083a89005",
    "file_count": 11,
    "restore_verified": true,
    "sha256": "c2fb1c36a5836a21d522de66a63ac07c4869de26aa0426093018a5c63cfabb00",
    "verified_before_rebuild": true
  },
  "sources": [
    {
      "authoritative_pack": {
        "active_pointer_verified": true,
        "catalog_id": "deeplaw-cn-official",
        "catalog_sequence": 2,
        "catalog_sha256": "49cf75169726e18851897556617fad4132881614c3f6ab9c6b2a78d4f8524305",
        "database_sha256": "f005d21b6809fe5d43cdadc7d01db3e44d5afce85e71b9bcedfd26458e261397",
        "release_id": "lawrel_a8c33b88404732614c39a557e8d76638",
        "signature_verified": true
      },
      "authority": "official",
      "byte_size": 346228,
      "compilation": {
        "build_report_sha256": "5f225ba990fee0f1b680254becffe4bf118c4ba4f8be7794f336ea9fa590f08e",
        "compilation_run_id": null,
        "compiler_profile": {
          "allowNeedsOcr": true,
          "pdfFallback": "document-engine"
        },
        "domain": "authoritative_pack_release_build",
        "release_id": "lawrel_a8c33b88404732614c39a557e8d76638"
      },
      "decision": "no_action",
      "derived_state": {
        "canvas": "not_applicable_authoritative_pack",
        "dense": "not_enabled",
        "fts": "ready",
        "graph": "ready",
        "wiki": "not_applicable_authoritative_pack"
      },
      "execution_status": "verified",
      "extraction_quality": {
        "characters": 2967,
        "coverage_ratio": 1.0,
        "needs_ocr": false,
        "pages": 4,
        "parse_risk": "none_recorded",
        "review_required": false,
        "review_required_fragment_count": 0,
        "skipped_fragment_count": 0,
        "warning_count": 0
      },
      "format": "PDF",
      "fragments": {
        "count": 4,
        "inventory_sha256": "92f99618b92f41d8c52be11ed9fdfbb09056c982c7e8f5a9d5f997964ad26d3e",
        "locator_complete": true,
        "order_stable": true,
        "stable_ids": true
      },
      "immutable_bytes_sha256": "0025f6ab6f48c6055cf9692ae88b46cc4800ff9e02f29dacbc9fab988e23b2e6",
      "immutable_bytes_verified": true,
      "knowledge_output": {
        "agent_interpretation": false,
        "applicability": "unknown",
        "freshness": "unknown",
        "legal_authority": true,
        "ranking_is_authority": false
      },
      "lifecycle": "unknown",
      "media_type": "application/pdf",
      "origin": "official",
      "parser": {
        "configuration": [
          "dpi=300",
          "language=chi_sim+eng",
          "psm=3",
          "tesseract=not-used",
          "renderer=pdftoppm version 24.02.0"
        ],
        "identity": "deeplaw-vision-consensus",
        "version": "deeplaw-vision-consensus/v2"
      },
      "reason_codes": [
        "immutable_source_bytes_verified",
        "signed_catalog_identity_verified",
        "exact_release_evidence_verified",
        "parser_and_extraction_equivalent"
      ],
      "retrieval_probe": {
        "citation_valid": true,
        "historical_probe": false,
        "provider_visible_bytes": 8777,
        "rank": 1,
        "repeated_query_stable": true
      },
      "rollback": {
        "baseline_release_id": "lawrel_1bee97015ee440c71ea993b083a89005",
        "restore_verified": true,
        "snapshot_sha256": "c2fb1c36a5836a21d522de66a63ac07c4869de26aa0426093018a5c63cfabb00"
      },
      "scope": "law_support_official",
      "sensitivity": "public",
      "source_ir": {